城市,id,景點名稱,google map,開放時間,電話,地址,簡介
花蓮,4,富源國家森林遊樂區,https://www.google.com/maps/embed?pb=!1m18!1m12!1m3!1d3656.4472208402944!2d121.34828857352977!3d23.58828879498402!2m3!1f0!2f0!3f0!3m2!1i1024!2i768!4f13.1!3m3!1m2!1s0x346f4c001d686def%3A0x9c874c92372c23a!2z5a-M5rqQ5ZyL5a625qOu5p6X6YGK5qiC5Y2A!5e0!3m2!1szh-TW!2stw!4v1703498638103!5m2!1szh-TW!2stw,週一至週日 08:00~17:00, 03 881 2377,花蓮縣瑞穗鄉廣東路161號,富源森林遊樂區擁有多條林間步道、吊橋、瀑布，以及知名賞蝶泡湯的蝴蝶谷。在每年3月至8月是蝴蝶谷絕佳的賞蝶季節，來到這裡能瞧見青帶鳳蝶、端紅蝶、蛇目蝶等30多種蝴蝶翩翩起舞。在3月至5月、9月至11月間，還能夠欣賞黑翅螢及台灣山窗螢，每當夜幕低垂，看到點點螢光在草地林間閃爍飛舞時，總是令人讚嘆不已。
花蓮,5,東大門夜市,https://www.google.com/maps/embed?pb=!1m18!1m12!1m3!1d1822.8217661795277!2d121.6100124882228!3d23.973042245465457!2m3!1f0!2f0!3f0!3m2!1i1024!2i768!4f13.1!3m3!1m2!1s0x34689fea21a7d07b%3A0x2aebf303593ddebf!2z5p2x5aSn6ZaA5aSc5biC!5e0!3m2!1szh-TW!2stw!4v1703498660908!5m2!1szh-TW!2stw,週一至週日 17:30~23:30, 03 822 7171,花蓮縣花蓮市重慶路415號,花蓮東大門國際觀光夜市，簡稱東大門夜市，以原有南濱夜市、福町夜市、自強夜市、彩虹夜市遷移整併而來，是台灣花蓮縣花蓮市重慶路及中山路口的一個夜市，橫跨花蓮市第二聯合里的民主里、民族里及民治里，位於舊有的台鐵花蓮車站及花蓮機務段處，架構可細分成福町夜市、自強夜市、原住民一條街及大陸各省一條街四大區域，占地約9公頃。
台東,1,星星部落景觀咖啡,https://www.google.com/maps/embed?pb=!1m18!1m12!1m3!1d3677.7742223014293!2d121.15091260308036!3d22.810828420521027!2m3!1f0!2f0!3f0!3m2!1i1024!2i768!4f13.1!3m3!1m2!1s0x346fbb77c422c9b9%3A0x6b91e743b1ab0b39!2z5pif5pif6YOo6JC95pmv6KeA5ZKW5ZWh!5e0!3m2!1szh-TW!2stw!4v1703498702492!5m2!1szh-TW!2stw,週一至週日 18:00~01:30,08 923 8089,台東縣卑南鄉富源村8鄰116之3號,星星部落位於台東富源村，沿著197縣道駛上光害漸少的海岸山脈，幾陣蜿蜒後坐在園區中，享受視野寬廣的夜景，桌上的煤油燈增添一絲復古氣氛，咖啡、飲品、餐點眾多且價格親切，遠離城市塵囂，偶有兔子出沒在園區內，更顯台東慢活滋味，是聊天消遣的好去處。
台東,2,米國學校,https://www.google.com/maps/embed?pb=!1m18!1m12!1m3!1d3670.9856928913805!2d121.16422448885493!3d23.060986099999997!2m3!1f0!2f0!3f0!3m2!1i1024!2i768!4f13.1!3m3!1m2!1s0x346f098bde520717%3A0x25c55efce964d651!2z57Gz5ZyL5a245qChIC0g6Zec5bGx6Y6u6L6y5pyD5LyR6ZaS5peF6YGK5Lit5b-D!5e0!3m2!1szh-TW!2stw!4v1703498728000!5m2!1szh-TW!2stw,週一至週日 08:00~17:00,08 981 4903,台東縣關山鎮昌林路24之1號,米國學校是一處以米為主題之休閒體驗場所，提供遊客看米（製米過程）、玩米（製米體驗活動）、吃米（米食DIY）、帶著米回家（關山米直銷）的多功能體驗園區，讓台灣農村保有農業的本質，創新農業的價值，將農業永續傳承。
台東,3,伯朗大道,https://www.google.com/maps/embed?pb=!1m18!1m12!1m3!1d7339.906535546834!2d121.2039899777099!3d23.098806500000002!2m3!1f0!2f0!3f0!3m2!1i1024!2i768!4f13.1!3m3!1m2!1s0x346f09ee2a72ab65%3A0xda93a34a2927bc8!2z5rGg5LiK5Lyv5pyX5aSn6YGT!5e0!3m2!1szh-TW!2stw!4v1703498753874!5m2!1szh-TW!2stw,24小時,089-862041, 臺東縣池上鄉伯朗大道 ,筆直的伯朗大道正式名稱為錦新三號道路，全長約2.2公里，由於兩旁毫無電線桿，加上逢稻穗成熟時，道路兩旁無邊無際的金色稻穗隨風搖曳，寧靜的田園景緻，被伯朗咖啡選中拍攝廣告，之後知名藝人代言的長榮航空亦來此取景，自此聲名大噪，將這條道路暱稱為「伯朗大道」。
台東,4,台東巨蛋樂園,https://www.google.com/maps/embed?pb=!1m18!1m12!1m3!1d3678.919675583503!2d121.10010527349773!3d22.768362025770415!2m3!1f0!2f0!3f0!3m2!1i1024!2i768!4f13.1!3m3!1m2!1s0x346fb945d91fabdb%3A0xbe39b0c8c69f60e4!2z5Y-w5p2x5beo6JuL5qiC5ZyS!5e0!3m2!1szh-TW!2stw!4v1703498782741!5m2!1szh-TW!2stw,週一至週日 09:30~18:30,0978 718 750,台東縣台東市南島大道502號,台東巨蛋樂園由綺麗集團所成立，2021/02/10開始營運，就在綺麗珊瑚文化園區內，是台東最大室內兒童遊戲樂園，有超多遊樂設施，戶外另有卡丁車、夏季水樂園可以玩。
台東,5,三仙台,https://www.google.com/maps/embed?pb=!1m18!1m12!1m3!1d29354.002035611382!2d121.39380891115681!3d23.124526230473887!2m3!1f0!2f0!3f0!3m2!1i1024!2i768!4f13.1!3m3!1m2!1s0x346f7048ec3e51a7%3A0xb2aab758fa333bb8!2z5LiJ5LuZ5Y-w!5e0!3m2!1szh-TW!2stw!4v1703498809072!5m2!1szh-TW!2stw,24小時, 08 985 4097,台東縣成功鎮基翬路74號,三仙台位於成功東北方約3公里處（11號省道110.5K處），是由突出的海岬與離岸小島所構成的。 因島上有三塊巨石，民間穿鑿附會傳說八仙過海時呂洞賓、何仙姑、李鐵拐曾登臨此處而聲名大噪。
